V1,V2,V3,V4,V5,V6,V7,year,fiction,protagonist,pro.type,antagonist,topic,sentiment,moral,moral.pos,moral.neg,archetype,decade
12253,/m/036xv,Gaudy Night,Dorothy L. Sayers,1935,"{/m/02n4kr: Mystery, /m/028v3: Detective fiction, /m/05hgj: Novel, /m/02xlf: Fiction, /m/0c3351: Suspense}","Harriet Vane returns reluctantly to Oxford to attend the Gaudy dinner. Expecting hostility because of her notoriety, she is surprised to be welcomed warmly by the dons, and rediscovers her old love of the academic life. Some time later the Warden of Shrewsbury writes to ask for help. There has been an outbreak of anonymous letters, vandalism and threats, apparently from someone within the college, and a scandal is feared. Harriet, herself a victim of poison-pen letters ever since her trial, reluctantly agrees to help, and spends much of the next few months resident at the college, ostensibly to do research on Sheridan Le Fanu and assist a don with her book. As she wrestles with the case, trying to narrow down the list of suspects and avert a major scandal, Harriet is forced to examine her ambivalent feelings about love and marriage, along with her attraction to academia as an intellectual (and emotional) refuge. Her personal dilemma becomes entangled with darkly hinted suspicions and prejudices raised by the crimes at the college, which appear to have been committed by a sexually frustrated female don. Harriet is forced to re-examine her relationship with Wimsey in the light of what she has discovered about herself. Wimsey eventually arrives in Oxford to help her, and she gains a new perspective on him from those who know him, including his nephew, a current undergraduate at the university. The attacks build to a crisis, and the college community of students, dons and servants is almost torn apart by suspicion and fear. There is an attempt to drive a vulnerable student to suicide, and a physical assault on Harriet that almost kills her. The perpetrator is finally unmasked by Wimsey as one of the college servants, revealed to be the widow of a disgraced academic at a northern university. Her husband's academic fraud had been exposed by one of his fellow dons there, destroying his career and driving him to suicide. The don has since moved to Shrewsbury College, and the campaign has been the widow's revenge against intellectual women who move outside their proper domestic sphere. At the end of the book, Harriet Vane finally accepts Wimsey's proposal of marriage. (Their marriage and honeymoon—interrupted by another murder mystery—are depicted in Busman's Honeymoon.)",1935,1,Harriet Vane,hero,revenge,academic intrigue,3,"The moral of the story is that confronting one's past and personal fears can lead to growth, understanding, and ultimately, the resolution of complex emotional and intellectual conflicts.","Confrontation, Growth, Resolution",Revenge,the quest,1930
15608,/m/03_b7,Johnny Got His Gun,Dalton Trumbo,1939,"{/m/02xlf: Fiction, /m/05hgj: Novel}","Joe Bonham, a young soldier serving in World War I, awakens in a hospital bed after being caught in the blast of an exploding artillery shell. He gradually realizes that he has lost his arms, legs, and all of his face (including his eyes, ears, teeth, and tongue), but that his mind functions perfectly, leaving him a prisoner in his own body. Joe attempts suicide by suffocation, but finds that he had been given a tracheotomy which he can neither remove nor control. At first Joe wishes to die, but later decides that he desires to be placed in a glass box and toured around the country in order to show others the true horrors of war. After he successfully communicates with his doctors by banging his head on his pillow in Morse code, however, he realizes that neither desire will be granted; it is implied that he will live the rest of his natural life in his condition. As Joe drifts between reality and fantasy, he remembers his old life with his family and girlfriend, and reflects upon the myths and realities of war. He also forms a bond, of sorts, with a young nurse who senses his plight.",1939,1,Joe Bonham,victim,war,the horrors of war,1,"The moral of the story is that war's true cost is often the profound and irreversible damage it inflicts on individuals, both physically and psychologically, challenging the glorified perceptions of heroism and patriotism.","War, Sacrifice, Resilience",Glorifying war,the tragic hero,1930
17414,/m/04fpm,Icehenge,Kim Stanley Robinson,1984,"{/m/06n90: Science Fiction, /m/014dfn: Speculative fiction}","Icehenge is part mystery, part psychological drama, and is set in three distinct time periods. The story shifts from a failed Martian political revolution of 2248, to an expedition to explore a mysterious monument on the north pole of Pluto three centuries later, and ultimately to a space station orbiting Saturn, home to a reclusive and wealthy woman who may hold the key to solving a mystery spanning centuries.",1984,1,Emma Weil,none,mystery,memory,3,The moral of the story is that the pursuit of truth across time and space can reveal complex layers of human motivation and history.,"Truth, Complexity, History",Obsession,the quest,1980
19002,/m/04svn,Microserfs,Douglas Coupland,1995-06,"{/m/02ql9: Epistolary novel, /m/02xlf: Fiction}","The plot of the novel has two distinct movements: the events at Microsoft and in Redmond, Washington, and the movement to Silicon Valley and the Oop! project. The novel begins in Redmond as the characters are working on different projects at Microsoft's main campus. Life at the campus feels like a feudalistic society, with Bill Gates as the lord, and the employees the serfs. The majority of the main characters—Daniel (the narrator), Susan, Todd, Bug, Michael, and Abe—are living together in a geek house, and their lives are dedicated to their projects and the company. Daniel's foundations are shaken when his father, a longtime employee of IBM, is laid off. The lifespan of a Microsoft coder weighs heavily on Daniel's mind. The second movement of the novel begins when the characters are offered jobs in Silicon Valley working on a project for Michael, who has by then left Redmond. All of the housemates—some immediately, some after thought—decide to move to the Valley. The characters' lives change drastically once they leave the limited sphere of the Microsoft campus and enter the world of One-Point-Oh. They begin to work on a project called Oop! (a reference to object-oriented programming). Oop! is a Lego-like design program, allowing dynamic creation of many objects, bearing a resemblance to 2009's Minecraft. (Coupland appears on the rear cover of the novel's hardcover versions photographed in Denmark's Legoland Billund, holding a Lego 747.) One of the undercurrents of the plot is Daniel and his family's relationship to Jed, Daniel's younger brother who died in a boating accident while they were children.",1995,1,Daniel,hero,change,transition and adaptation,3,"The moral of the story is that embracing change and innovation, while confronting personal and professional challenges, leads to growth and new opportunities.","Innovation, Resilience, Transformation",Complacency,the quest,1990
21725,/m/05g5q,Neuromancer,William Gibson,1984-07-01,"{/m/01qpc: Cyberpunk, /m/06n90: Science Fiction, /m/014dfn: Speculative fiction, /m/026ny: Dystopia}","Henry Dorsett Case is a low-level hustler in the dystopian underworld of Chiba City, Japan. Once a talented computer hacker, Case was caught stealing from his employer. As punishment for his theft, Case's central nervous system was damaged with a mycotoxin, leaving him unable to use keyboard skills to access the global computer network in cyberspace, a virtual reality dataspace called the Matrix. Unemployable, addicted to drugs, and suicidal, Case desperately searches the Chiba black clinics for a miracle cure. Case is saved by Molly Millions, an augmented street samurai and mercenary for a shadowy ex-military officer named Armitage, who offers to cure Case in exchange for his services as a hacker. Case jumps at the chance to regain his life as a console cowboy, but neither Case nor Molly know what Armitage is really planning. Case's nervous system is repaired using new technology that Armitage offers the clinic as payment, but he soon learns from Armitage that sacs of the poison that first crippled him have been placed in his blood vessels as well. Armitage promises Case that if he completes his work in time, the sacs will be removed; otherwise they will dissolve, disabling him again. He also has Case's pancreas replaced and new tissue grafted into his liver, leaving Case incapable of metabolizing cocaine or amphetamines and apparently ending his drug addiction. Case develops a close personal relationship with Molly, who suggests that he begin looking into Armitage's background. Meanwhile, Armitage assigns them their first job: they must steal a ROM module that contains the saved consciousness of one of Case's mentors, legendary cyber-cowboy McCoy Pauley, nicknamed Dixie Flatline. Pauley's hacking expertise is needed by Armitage, and the ROM construct is stored in the corporate headquarters of media conglomerate Sense/Net. A street gang named the Panther Moderns are hired to create a simulated terrorist attack on Sense/Net. The diversion allows Molly to penetrate the building and steal Dixie's ROM. Case and Molly continue to investigate Armitage, discovering his former identity of Colonel Willis Corto. Corto was a member of Operation Screaming Fist, which planned on infiltrating and disrupting Soviet computer systems from ultralight aircraft dropped over Russia. The Russian military had learned of the idea and installed defenses to render the attack impossible, but the military went ahead with Screaming Fist, with a new secret purpose of testing these Russian defenses. As the Operation team attacked a Soviet computer center, EMP weapons shut down their computers and flight systems, and Corto and his men were targeted by Soviet laser defenses. He and a few survivors commandeered a Soviet military helicopter and escaped over the heavily guarded Finnish border. Everyone was killed except Corto, who was seriously wounded and heavily mutilated by Finnish defense forces attacking as they were landing the helicopter. Corto after some months in hospital is visited by a Government military official and then medically rebuilt to be able to provide what he came to realise was fake testimony, designed to mislead the public and protect the military officers who had covered up knowledge of the EMP weapons. After the trials, Corto snaps, killing the Government official who contacted him and then disappears into the criminal underworld. In Istanbul, the team recruits Peter Riviera, an artist, thief, and drug addict who is able to project detailed holographic illusions with the aid of sophisticated cybernetic implants. Although Riviera is a sociopath, Armitage coerces him into joining the team. The trail leads Case and Molly to a powerful artificial intelligence named Wintermute, created by the plutocratic Tessier-Ashpool family, who spend most of their inactive time in cryonic preservation inside Villa Straylight, a labyrinthine mansion located at one end of Freeside, a cylindrical space habitat located at L5, and functioning primarily as a Las Vegas-style space resort for the wealthy. Wintermute's nature is finally revealed – it is one-half of a super-AI entity planned by the family, although its exact purpose is unknown. The Turing Law Code governing AIs bans the construction of such entities; to get around this, it had to be built as two separate AIs. Wintermute was programmed by the Tessier-Ashpool dynasty with a need to merge with its other half – Neuromancer. Unable to achieve this merger on its own, Wintermute recruited Armitage and his team to help complete the goal. Case is tasked with entering cyberspace to pierce the Turing-imposed software barriers using a powerful icebreaker program. At the same time, Riviera is to obtain the password to the Turing lock from Lady 3Jane Marie-France Tessier-Ashpool, an unfrozen daughter clone and the current leader of Tessier-Ashpool SA. Wintermute believes Riviera will pose an irresistible temptation to her, and that she will give him the password. The password must be spoken into an ornate computer terminal located in the Tessier-Ashpool home in Villa Straylight, and entered simultaneously as Case pierces the software barriers in cyberspace – otherwise the Turing lock will remain intact. Armitage's team attracts the attention of the Turing Police, whose job is to prevent AIs from exceeding their built-in limitations. As Molly and Riviera gain entrance to Villa Straylight, three officers arrest Case and take him into custody; Wintermute manipulates the orbital casino's security and maintenance systems and kills the officers, allowing Case to escape. The Armitage personality starts to disintegrate and revert to the Corto personality as he relives Screaming Fist. It is revealed that in the past, Wintermute had originally contacted Corto through a bedside computer during his convalescence, eventually convincing Corto that he was Armitage. Wintermute used him to persuade Case and Molly to help it merge with its twin AI, Neuromancer. Finally, Armitage becomes the shattered Corto again, but his newfound personality is short-lived as he is killed by Wintermute. Inside Villa Straylight, Molly is captured by Riviera and Lady 3Jane. Worried about Molly and operating under orders from Wintermute, Case tracks her down with help from Maelcum, his Rastafarian pilot. Neuromancer attempts to trap Case within a cyber-construct where he finds the consciousness of Linda Lee, his girlfriend from Chiba City, who was murdered by one of Case's underworld contacts. Case manages to escape flatlining inside the construct by choosing of his own free will not to stay. Freeing himself, Case takes Maelcum and confronts Lady 3Jane, Riviera, and Hideo, Lady 3Jane's ninja bodyguard. Riviera tries to kill Case, but Lady 3Jane is sympathetic towards Case and Molly, and Hideo protects him. Riviera blinds Hideo, but flees when he learns that the ninja is just as adept without his sight. Molly then explains to Case that Riviera is doomed anyway, as he has been fatally poisoned by his drugs, which she had spiked. With Lady 3Jane in possession of the password, the team makes it to the computer terminal. Case ascends to cyberspace to guide the icebreaker to penetrate its target; Lady 3Jane is induced to give up her password and the lock is opened. Wintermute unites with Neuromancer, fusing into a greater entity. The poison in Case's bloodstream is washed out, and he and Molly are handsomely paid for their efforts, while Pauley's ROM construct is apparently erased, at his own request. In the epilogue, Molly leaves Case. Case finds a new girlfriend, resumes his hacking work, and spends his earnings from the mission replacing his internal organs so that he can continue his previous drug use. Wintermute/Neuromancer contacts him, saying that it has become the sum total of the works, the whole show, and has begun looking for other AIs like itself. Scanning old recorded transmissions from the 1970s, the super-AI finds a lone AI transmitting from the Alpha Centauri star system. In the matrix, Case hears inhuman laughter, a trait associated with Pauley during Case's work with his ROM construct, thus suggesting that Pauley was not erased after all, but instead worked out a side deal with Wintermute/Neuromancer to be freed from the construct so he could exist in the matrix. In the end, while logged into the matrix, Case catches a glimpse of himself, his dead girlfriend Linda Lee, and Neuromancer. The implication of the sighting is that Neuromancer created a copy of Case's consciousness when it previously tried to trap him. The copy of Case's consciousness now exists with that of Linda's, in the matrix, where they are together forever.",1984,1,Case,victim,control,artificial intelligence,3,The moral of the story is that the pursuit of autonomy and identity in a technologically dominated world often leads to unforeseen consequences and transformations of self.,"Autonomy, Technology, Transformation",Betrayal,the heros journey,1980
21861,/m/05h8j,Cryptonomicon,Neal Stephenson,1999,"{/m/02xlf: Fiction, /m/05hgj: Novel}","The action takes place in two periods: the Second World War and the late 1990s, during the Internet boom. In 1942, Lawrence Pritchard Waterhouse, a young U.S. Navy code breaker and mathematical genius, is assigned to the newly formed joint British and American Detachment 2702. This ultra-secret unit's role is to hide the fact that Allied Intelligence has cracked the German Enigma code. The detachment stages events, often behind enemy lines, that provide alternative explanations for the Allied intelligence successes. Marine sergeant Bobby Shaftoe, a veteran of China and Guadalcanal, serves in unit 2702, carrying out Waterhouse's plans. At the same time, Japanese soldiers including mining engineer Goto Dengo, an old friend of Shaftoe's, are assigned to build a mysterious bunker in the mountains in the Philippines as part of what turns out to be a literal suicide mission. Circa 1997, Randy Waterhouse (Lawrence's grandson) joins his old Dungeons and Dragons companion Avi Halaby in a new startup, providing Pinoy-grams to migrant Filipinos via new fiber-optic cables. The aptly named Epiphyte Corporation uses this income stream to fund the creation of a data haven in the nearby fictional Sultanate of Kinakuta. Vietnam veteran Doug Shaftoe and his daughter Amy do the undersea surveying for the cables and engineering work on the haven is overseen by Goto Furudenendu, heir-apparent to Goto Engineering. Complications arise as figures from the past reappear seeking gold or revenge.",1999,1,Lawrence Pritchard Waterhouse,hero,secrecy,cryptography,3,"The moral of the story is that the actions and secrets of the past inevitably shape and intertwine with the present, influencing future generations and their endeavors.","Legacy, Secrecy, Interconnection",Secrecy,the quest,1990
64199,/m/0h5l0,Solaris,Stanisław Lem,1961,"{/m/06n90: Science Fiction, /m/014dfn: Speculative fiction, /m/05hgj: Novel, /m/059r08: Psychological novel}","Solaris chronicles the ultimate futility of attempted communications with the extraterrestrial life on a far-distant planet. Solaris, with whom Terran scientists are attempting communication, is almost completely covered with an ocean that is revealed to be a single, planet-encompassing organism. What appear to be waves on its surface are later revealed to be the equivalents of muscle contractions. Kris Kelvin arrives aboard the scientific research station hovering (via anti-gravity generators) near the oceanic surface of the planet Solaris. The scientists there have studied the planet and its ocean for many decades, a scientific discipline known as Solaristics, which over the years has degenerated to simply observe, record and categorize the complex phenomena that occur upon the surface of the ocean. Thus far, they have only achieved the formal classification of the phenomena with an elaborate nomenclature — yet do not understand what such activities really mean in a strictly scientific sense. Shortly before psychologist Kelvin's arrival, the crew has exposed the ocean to a more aggressive and unauthorized experimentation with a high-energy X-ray bombardment. Their experimentation gives unexpected results and becomes psychologically traumatic for them as individually flawed humans. The ocean's response to their aggression exposes the deeper, hidden aspects of the personalities of the human scientists — whilst revealing nothing of the ocean’s nature itself. To the extent that the ocean’s actions can be understood, the ocean then seems to test the minds of the scientists by confronting them with their most painful and repressed thoughts and memories. It does this via the materialization of physical human simulacra; Kelvin confronts memories of his dead lover and guilt about her suicide. The torments of the other researchers are only alluded to but seem even worse than Kelvin’s personal purgatory. The ocean’s intelligence expresses physical phenomena in ways difficult for their limited earth science to explain, deeply upsetting the scientists. The alien (extraterrestrial) mind of Solaris is so greatly different from the human mind of (objective) consciousness that attempts at inter-species communications are a dismal failure.",1961,1,Kris Kelvin,victim,incomprehension,the central topic of solaris is communication with extraterrestrial intelligence,2,The moral of the story is that the pursuit of understanding and communicating with fundamentally alien forms of consciousness may reveal more about the depths of our own humanity and limitations than about the entities we seek to understand.,"Alienation, introspection, misunderstanding.",Hubris,the journey,1960
