V1,V2,V3,V4,V5,V6,V7,year,fiction,protagonist,pro.type,antagonist,topic,sentiment,moral,moral.pos,moral.neg,archetype,decade
68857,/m/0hznb,The Player of Games,Iain Banks,1988,"{/m/06n90: Science Fiction, /m/014dfn: Speculative fiction}","Jernau Morat Gurgeh, a famously skilful player of board games and other similar contests, lives on Chiark Orbital, and is bored with his successful life. The Culture's Special Circumstances inquires about his willingness to participate in a long journey, though won't explain further unless Gurgeh agrees to participate. While he is considering this offer, one of his drone friends, Mawhrin-Skel, which had been ejected from Special Circumstances due to its unstable personality, convinces him to cheat in one of his matches in an attempt to win in an unprecedented perfect fashion. The attempt fails, but Mawhrin-Skel uses his recording of the event to blackmail Gurgeh into accepting the offer and insisting that Mawhrin-Skel be admitted back into Special Circumstances as well. Gurgeh spends the next two years travelling to the Empire of Azad in the Small Magellanic Cloud, where a complex game (also named Azad) is used to determine social rank and political status. The game itself is sufficiently subtle and complex that a player's tactics reflect his own political and philosophical outlook. By the time he arrives, he has grasped the game but is unsure how he will measure up against opponents who have been studying it for their entire lives. Gurgeh lands on the Empire's home planet of Eä, accompanied by another drone, Flere-Imsaho. As a Culture citizen, he naturally plays with a style markedly different from his opponents, many of whom stack the odds against him one way or another, such as forming backroom agreements to cooperate against him (which is allowed by the game's rules). As he advances through the tournament he is matched against increasingly powerful Azad politicians, and ultimately the Emperor himself in the final round. Faced with defeat, the Emperor attempts to kill Gurgeh, but is himself killed by a shot from his own weapon, deflected by Flere-Imsaho (who later refuses to tell Gurgeh if it was coincidental). Flere-Imsaho reveals that Gurgeh's participation was part of a Culture plot to overthrow the corrupt and savage Empire from within, and that he, the player, was in fact a pawn in a much larger game. Although Gurgeh never discovers the whole truth, it is ultimately revealed to the reader that Flere-Imsaho was the same drone as Mawhrin-Skel, who was also the narrator of the novel itself.",1988,1,Jernau Morat Gurgeh,hero,manipulation,the interplay between games and society,3,"The moral of the story is that individuals, even those who believe they are in control, can themselves be pawns in larger, more complex games of power and manipulation.","Control, Manipulation, Strategy",Cheating,the heros journey,1980
69111,/m/0j087,"So Long, and Thanks for All the Fish",Douglas Adams,1984,"{/m/06n90: Science Fiction, /m/014dfn: Speculative fiction, /m/02xlf: Fiction, /m/02yq81: Comic novel, /m/09kqc: Humour, /m/0hh4w: Comic science fiction}","Arthur Dent has hitch-hiked through the galaxy and is dropped off on a planet in a rainstorm. He realises that he appears to be in England on Earth, even though he saw it destroyed by the Vogons. While he has been gone for several years, it appears only a few months have passed on Earth. He manages to hitch a ride with a man named Russell, who is driving home his sister Fenchurch (Fenny for short). Russell explains that she had become delusional after worldwide mass hysteria over the hallucinations with the big yellow spaceships (Vogon Ships). Arthur also learns that all the dolphins disappeared shortly after that event. Arthur becomes curious about Fenchurch, but they reach his home before he can ask more questions. Inside his still-standing home, Arthur finds a gift-wrapped bowl inscribed with the words So Long and Thanks... which he then uses for his Babel Fish. Arthur considers that Fenchurch is somehow connected to him and to the Earth's destruction, and finds that he still has the ability to fly whenever he lets his thoughts wander. After putting his life in order, Arthur tries to find out more about Fenchurch. He catches her hitchhiking and he learns more about her. He obtains her phone number but loses it. He finds her home when he locates the cave he had lived in after crashing onto prehistoric Earth with the Golgafrinchans: her flat is built on the same spot. As they talk they find more circumstances connecting them. Fenchurch reveals that, moments before her hallucinations, she had an epiphany while sitting in a café about how to make everything right, but then blacked out. Ever since, she has not been able to recall it. After noticing that Fenchurch's feet do not touch the ground, Arthur teaches her how to fly and together they make love in the skies over London. The two travel to California to see John Watson, an enigmatic scientist who purports to know the cause of the dolphins' disappearance and who eschewed his original name in favour of Wonko the Sane due to harbouring the belief that the entire world's population save himself has gone mad. Watson shows the couple a bowl with the words So long and thanks for all the fish inscribed on it that they all own and encourages them to listen to it. They learn from the bowl's audio message that the dolphins, aware of the Vogons, left Earth for an alternate dimension but not before replacing the destroyed Earth with a new version and transporting everything to it as a way of saving humans. Arthur explains to Fenchurch about hitchhiking across the galaxy, after which she insists that she wants to see it as well. They plan to hitchhike on the next passing spaceship. Concurrent to these events, Ford Prefect discovers that during an update of the Hitchhiker's Guide, his previous entry for Earth, Mostly harmless, has been replaced with the volumes of text he wrote during his research. Recognising that something is strange, Ford begins to hitchhike across the galaxy to reach Earth, eventually using the ship of a giant robot to land in the centre of London and causing a panic. In the chaos, Ford meets up with Arthur and Fenchurch and together they commandeer the robot's ship. Arthur takes Fenchurch to the planet where God's Final Message to His Creation is written, and they happen across Marvin, who, because of previous events, is now approximately 37 times older than the known age of the universe and is barely able to continue. Marvin, with Arthur and Fenchurch's help, reads the Message (We apologise for the inconvenience), smiles, utters the final words I think... I feel good about it, and dies happily.",1984,1,Arthur Dent,hero,vogons,existentialism,4,"The moral of the story is that in the vast and unpredictable universe, finding connection, purpose, and a sense of belonging can transform the most bewildering experiences into meaningful adventures.","Connection, Purpose, Adventure",Apathy,the quest,1980
69485,/m/0j2th,Choke,Chuck Palahniuk,2001-05-22,"{/m/0vgkd: Black comedy, /m/05hgj: Novel, /m/06nbt: Satire, /m/014dfn: Speculative fiction, /m/02xlf: Fiction}","Choke follows Victor Mancini and his friend Denny through a few months of their lives with frequent flashbacks to the days when Victor was a child. He had grown up moving from one foster home to another, as his mother was found to be unfit to raise him. Several times throughout his childhood, his mother would kidnap him from his various foster parents, though every time they would eventually be caught, and he would again be remanded over to the governmental child welfare agency. In the present day setting of the book, Victor is now a man in his mid-twenties who left medical school in order to find work to support his feeble mother who is now in a nursing home. He cannot afford the care that his mother is receiving so he resorts to being a con man. He consistently goes to various restaurants and purposely causes himself to choke mid-way through his meal, luring a good Samaritan into saving his life. He keeps a detailed list of everyone who saves him and sends them frequent letters about fictional bills he is unable to pay. The people feel so sorry for him that they send him cards and letters asking him about how he's doing and even continue to send him money to help him with the bills. He works at a re-enactment museum set in colonial times, where most of the employees are drug-addicts or, in his friend Denny's case, a fellow recovering sex addict. Most of the time Palahniuk spends describing Victor's job, Victor is guarding his friend Denny (who is constantly being caught with contraband, items that don't correspond with the time period of the museum) in the stocks. Victor first met Denny at a sexual addiction support group (he was there as a guy who masturbates too much), and they later applied together to the same job. Denny is later fired from the museum, and begins collecting stones from around the city to build his dream home; Palahniuk based this portion of the novel on the true story of Ferdinand Cheval. While growing up, Victor's mother taught him numerous conspiracy theories and obscure medical facts which both confused and frightened him. This and his constant moves from one home to another have left Victor unable to form lasting and stable relationships with women. Victor, as a result, finds himself getting sexual gratification from women on a solely superficial level (using sex anonymous meetings to find many of his sexual partners). Later on, he starts talking to his mother again for the first time in years. The narrative is episodic, and is presented out of chronological order, a style common to the author's books.",2001,1,Victor Mancini,victim,instability,dysfunction,2,The moral of the story is that unresolved past traumas and the lack of genuine human connections can lead individuals to destructive behaviors and a life filled with deceit and superficial relationships.,"Trauma, Deceit, Connection",Manipulation,the quest,2000
69868,/m/0j58l,A Friend of the Earth,T. Coraghessan Boyle,2000-09,"{/m/014dfn: Speculative fiction, /m/026ny: Dystopia}","A Friend of the Earth is the story of Tyrone O'Shaughnessy Tierwater, a U.S. citizen born in 1950, half Irish Catholic and half Jewish (I'm a mess and I know it. Jewish guilt, Catholic guilt, enviro-eco-capitalistico guilt: I can't even expel gas in peace.), whose personal tragedy fits in with, and adds to, the gloomy atmosphere created in the novel. Egged on by Andrea, the woman he loves, he becomes a committed Earth Forever! activist (an allusion to the radical environmental group Earth First!) in the 1980s, is imprisoned for ecotage, but eventually cannot change anything. On top of that, he suffers the loss of his first wife when their daughter is only three and of his daughter when she is only 25. When the novel opens, Tierwater is a 75-year-old disillusioned ex-con living on the estate of a famous pop star in the Santa Ynez Valley, north of Santa Barbara, in California and looking after the latter's private menagerie. Maclovio Pulchris, the singer, has had the idea of preserving some of the last surviving animals of several species in order to initiate a captive breeding programme at some later point in time, choosing to preserve the animals no-one else would. Tierwater has been working for Pulchris (Mac) for ten years when, in 2025, Andrea, his ex-wife and stepmother to his daughter Sierra, contacts him after more than 20 years. She and a friend of hers, April Wind, move in with Tierwater, officially for April Wind to write a biography, or rather hagiography, of Sierra Tierwater, his daughter, who died in 2001 as a martyr to the environmentalist cause. (A tree-hugging cunt, as their opponents called her, she falls off a tree in old growth woodland in which she has been living for about three years.) In the course of the next few months the situation deteriorates even more. The rain and the wind destroy the animals' cages, and subsequently they have to be kept in Pulchris's basement. One morning one of the lions gets loose and attacks and kills the singer, as well as a number of employees. As a consequence, the other lions are shot—and thus lions as a species become extinct. (There is just one surviving lion in the San Diego Zoo left.) Jobless and penniless, Tierwater, who has fallen in love all over again with Andrea, is evicted from the estate by Pulchris's heirs. Along with Andrea, Tyrone leaves the compound, heading for a mountain cabin owned by Earth Forever! somewhere in the forest which decades ago served as a hideout. They arrive there with only one of Pulchris's animals in tow: Petunia, the Patagonian fox, which they now keep as their domestic animal, passing it off as their dog. In the final scene of the book, a teenaged girl comes hiking along the trail where the forest surrounding the dilapidated cabin would have been. Tierwater and Andrea, who again call themselves husband and wife now, have a glimmer of hope that life will soon be like life 30 years before, as the novel ends on an optimistic note.",2000,1,Tyrone O'Shaughnessy Tierwater,victim,despair,environmental degradation,2,"The moral of the story is that despite the irreversible impacts of environmental degradation and personal loss, there is always a possibility for renewal and hope for a better future.","Renewal, Hope, Resilience",Apathy,the fall and redemption,2000
70070,/m/0j65x,The Weirdstone of Brisingamen,Alan Garner,1960,"{/m/014dfn: Speculative fiction, /m/01hmnh: Fantasy, /m/0dwly: Children's literature}","The book's introduction concerns the origin of the Weirdstone. Following the defeat of Nastrond, it was decided to take steps to prevent what must otherwise be his eventual return. This involved bringing together a small band of warriors of pure heart, each of whom must be partnered by a horse, and to gather them inside the old dwarf caves of Fundindelve, deep inside the hill of Alderley. The caves were sealed by powerful white magic which would both defend Fundindelve from evil, as the ages passed, and also prevent the warriors and their horses from aging. When the time was ripe, and the world once more in mortal peril, it was prophesied that this small band of warriors would ride out from the hill, trusting in their purity of heart to defeat Nastrond for good. Fundindelve was provided with a guardian, the ancient wizard Cadellin Silverbrow, and the heart of the white magic was sealed inside a jewel, the Weirdstone of Brisingamen. At the beginning of the story, however, the Weirdstone has been lost, stolen centuries before by a farmer whose milk-white mare Cadellin had bought to complete the numbers in Fundindelve. The stone became a family heirloom and eventually found its way to Susan's mother, who passed it on to Susan, who is oblivious as to its history and purpose. Although the children become friends with Cadellin, the wizard fails to notice the bracelet, even when the children come to visit him in Fundindelve. However, its presence does not go unnoticed by Selina Place and the witches of the morthbrood, who send their minions to steal it. Susan finally realizes the identity of the Weirdstone, and fearing its destruction, sets out to warn the wizard. The children return to Fundindelve but Cadellin is nowhere to be found, so they set out to reclaim the stone on their own. They are successful but become lost in a labyrinth of mineshafts and caverns. As the members of the morthbrood close in on them, they are rescued by a pair of dwarfs, Fenodyree and Durathror, who are close companions of Cadellin. After passing through many perils the group returns to the farm where Susan and Colin are staying to spend the night. They set out with the farm's owner the next day to return the weirdstone to Cadellin before it can fall into the wrong hands. Their travels take them through forests, mountains, and snowy fields while striving to avoid the attention of the morthbrood. At the climax of the story, a great battle takes place on a hill near Alderley during which the children and their companions make a desperate last stand to protect the Weirdstone. However the enemy forces prove too strong and Durathror is mortally wounded. Grimnir takes the Weirdstone for himself and, in the ensuing chaos, Nastrond sends the great wolf Fenrir (in some editions Managarm) to destroy his enemies. As the remaining companions begin to despair, Cadellin appears and slays Grimnir, whom he reveals to be his own brother. The Morrigan flees in terror while Cadellin uses the power of the Weirdstone to subdue once again the forces of darkness.",1960,1,Susan,hero,nastrond,the battle between good and evil,3,"The moral of the story is that courage, unity, and purity of heart can overcome even the most formidable forces of evil.","Courage, Unity, Purity",Complacency,the quest,1960
70153,/m/0j6sy,The Human Stain,Philip Roth,2000-05,"{/m/02xlf: Fiction, /m/05hgj: Novel}","The story is told by Nathan Zuckerman, a writer who lives quietly in New England, where Coleman Silk is his neighbor. Silk is a former classics professor and dean of faculty at nearby Athena College, a fictional institution in the Berkshires of western Massachusetts. At 71, Silk is accused of racism by two black students because of referring to them as spooks. As they have never shown up in his seminar, he asks: Do they exist or are they spooks? Having never seen the students, Silk does not know they are black when he makes the comment. The uproar leads to Silk's resignation. Soon after, his wife Iris dies of a stroke, which Silk feels is caused by the stress of his being forced out of the college. Silk begins an affair with Faunia Farley, a 34-year-old local woman who works as a janitor at the college and is married to an abusive Vietnam veteran. Silk is criticized by feminist scholars at the college for this. Zuckerman gradually learns that Silk is an African American who has presented himself as Jewish (and white) since a stint in the Navy. He completed graduate school, married a white woman and had four children with her. (He never told his wife and children of his mixed ancestry.) As Roth wrote in the novel, Silk chose to take the future into his own hands rather than to leave it to an unenlightened society to determine his fate.",2000,1,Coleman Silk,victim,prejudice,identity,2,"The moral of the story is that the complexities of identity, race, and personal choices can have profound and unforeseen consequences on one's life and the lives of those around them.","Identity, Consequences, Race",Prejudice,tragedy,2000
70206,/m/0j72r,Picnic at Hanging Rock,Joan Lindsay,1967,"{/m/02n4kr: Mystery, /m/0hwxm: Historical novel}","Picnic at Hanging Rock centers around a trip by a party of girls from Appleyard College, a fictitious upper class private boarding school, who travel to Hanging Rock in the Mount Macedon area, Victoria, for a picnic on Valentine's Day 1900. The excursion ends in tragedy when three of the girls, and later one of their teachers, mysteriously vanish while climbing the rock. No reason for their disappearance is ever given, and one of the missing girls who is later found has no memory of what has happened to her companions. A fourth girl who also climbed the rock with the group is of little help in solving the mystery, having returned in hysterics for reasons she cannot explain. The disappearances provoke much local concern and international sensation with sexual molestation, abduction and murder being high on the list of possible outcomes. Several organized searches of the picnic grounds and the area surrounding the rock itself turn up nothing. Meanwhile the students, teachers and staff of the college, as well as members of the community, grapple with the riddle-like events. A young man on a private search locates one of the missing girls, but is himself found in an unexplained daze – yet another victim of the rock. Concerned parents begin withdrawing their daughters from the formerly prestigious college and several of the staff, including the headmistress, either resign or meet with tragic ends. We are told that both the College, and the Woodend Police Station where records of the investigation were kept, are destroyed by fire shortly afterwards. The unsolvable mystery of the disappearances was arguably the key to the success of both the book and the subsequent film. This aroused enough lasting public interest that in 1980 a book of hypothetical solutions (by Yvonne Rousseau) was published, called The Murders at Hanging Rock. In fact, Lindsay's original draft included a final chapter in which the mystery was resolved. At her editor's suggestion, Lindsay removed it prior to publication. Chapter Eighteen, as it is known, was published posthumously in 1987 as The Secret of Hanging Rock by Angus & Robertson Publishing. The novel is written in the form of a true story, and even begins and ends with a pseudo-historical prologue and epilogue, adding to the overall feeling of mystery. However, while the geological feature, Hanging Rock, and the several towns mentioned are actual places near Mount Macedon, the story is not completely true. Lindsay had done little to dispel the myth that the story is based on truth, in many interviews either refusing to confirm it was entirely fiction, or hinting that parts of the book were fictitious, and others were not. Valentine's Day, 14 February 1900 was a Wednesday, not a Saturday as depicted in the story. All attempts by enthusiastic readers to find historical evidence of the event, characters, or even Appleyard College, have proved fruitless. Appleyard College was to some extent based on Clyde Girls' Grammar School at East St Kilda, Melbourne, which Joan Lindsay attended as a day-girl while in her teens. Incidentally, in 1919 this school was transferred to the town of Woodend, Victoria, about 8&nbsp;km southwest of Hanging Rock. The book suggests that the fictional site of Appleyard College, given its eastward view of Mount Macedon on the Bendigo-Melbourne Road, might have been on the western side of Calder Highway/Black Forest Drive (C792), about 2–4&nbsp;km south of Woodend. A far more detailed synopsis of the story is given in the main entry for the film version.",1967,1,Miranda,victim,mystery,mystery of disappearance,2,The moral of the story is that some mysteries are beyond human understanding and must be accepted as part of the natural and inexplicable mysteries of life.,"Mystery, Acceptance, Nature",Complacency,mystery,1960
