V1,V2,V3,V4,V5,V6,V7,year,fiction,protagonist,pro.type,antagonist,topic,sentiment,moral,moral.pos,moral.neg,archetype,decade
70258,/m/0j78y,"I, the Jury",Mickey Spillane,1947,"{/m/0lsxr: Crime Fiction, /m/02n4kr: Mystery, /m/02xlf: Fiction, /m/0c3351: Suspense}","New York City, summer 1944. Although she runs a successful private psychiatric clinic on New York's Park Avenue, Dr. Charlotte Manning &mdash; young, beautiful, blonde, and well-to-do &mdash; cannot get enough. In order to increase her profit, she gets involved with a group of criminals &mdash; a syndicate &mdash; specialising in both prostitution and drug-trafficking. The brains of the outfit is Hal Kines, who has had plastic surgery so that he looks much younger than he really is, this being how he gets hold of the young women whom he then turns into prostitutes. Manning herself has a rich and ritzy clientele &mdash; people who would not want their addiction to become public knowledge. But instead of weaning them off drugs in her private and exclusive clinic, Manning makes them even more dependent on both the drug &mdash; heroin in most cases &mdash; and on herself by procuring the stuff herself. On the surface, Charlotte Manning keeps up appearances and leads a respectable life as a renowned psychiatrist. When Jack Williams, a former New York cop who has lost an arm in World War II saving his friend Mike Hammer's life, falls in love with Myrna Devlin, a young heroin addict whom he stops from jumping off a bridge to commit suicide, he asks Manning to admit her to her clinic for psychotherapy. After Myrna has become clean, she and Williams become engaged, and the couple keep up a casual friendship with Charlotte Manning. This is how Williams's growing suspicions about Manning's business lead him to privately and secretly investigate even further into the matter. When he realizes that Hal Kines, one of Manning's college students who has spent some time at her clinic and who has become one of her casual acquaintances, is in fact a criminal, he wants to talk to her about it and tells her so. When, at a party given by Williams in his apartment, Charlotte Manning sees some old college yearbooks whose contents (and photos), if made public, would expose Kines's double life, she has to act fast. After the party, she goes home but on the same night, undetected by Kathy, her maid, goes back to Williams's apartment (Myrna, his fiancée, does not live there) and shoots him in the stomach using a silencer. She does so in a particularly sadistic way, watching him die slowly. Then she takes the college yearbooks and leaves. None of the guests at Williams's party has a watertight alibi, but to both Pat Chambers, the cop investigating the murder, and Mike Hammer, a friend of his and private investigator, none of them has a motive either. Throughout the book, as more and more immediate suspects are eliminated (shot) (If this kept up there wouldn't be anyone left at all.), Hammer briefly ponders the question if the killer could be an outsider &mdash; someone wholly unrelated to the group of people who have been at Williams's party, for example someone Williams was after in his capacity as investigator for an insurance company. Chambers also thinks along similar lines: Williams's (secret) connection with Myrna's former drug dealers might have cost him his life. But they soon abandon that theory. When Mike Hammer sees Williams's body (For the first time in my life I felt like crying), he makes a solemn vow: He promises that he will find the murderer and execute him himself, avoiding the U.S. judicial system altogether. He says that if he left it to the courts to punish the perpetrator, some clever lawyer would surely achieve an acquittal and the murderer would get away with his crime. This is why he himself will be the jury &ndash; and the judge, for that matter. Throughout their basically separate investigations, Hammer and Chambers work closely together, exchanging information and evidence. But each of them hopes he will be the one to find the killer in the end. The immediate suspects Hammer finds himself confronted with are: * Esther and Mary Bellemy, identical twins in their late twenties living in a New York apartment hotel, rather attractive women of independent means, with a large estate somewhere in the country. Both are unmarried and obviously looking for husbands. Later, Hammer finds out &mdash; through first-hand experience &mdash; that Mary Bellemy is a nymphomaniac. Esther Bellemy, whom he never gets to know intimately, is no virgin either, but much more reserved than her sister Mary, with whom Hammer actually has sex on two separate occasions. * George Kalecki, whom Hammer knows to have been a crook &mdash; a bootlegger, to be precise &mdash; but who has obviously achieved a clean record and who now appears to be Hal Kines's paternal friend, paying for the latter's tuition and giving him food and lodging. (In fact it is the other way round: Hal Kines, the big shot and the brains of the syndicate, has a hold on Kalecki: Hidden away in the vaults of some bank he has documents proving that Kalecki is a killer on the loose.) * Hal Kines, who poses as a student of medicine but who is in fact the head of a criminal organisation specializing in prostitution and drug-dealing. His very sophisticated &mdash; and complicated &mdash; way of procuring willing women for his outfit can only be understood if one considers the morally repressed society of the late 1940s: Again and again, he assumes the role of John Hanson, a student in some provincial college (for example in the Midwest), pretends falling in love with a female student, makes her pregnant, forces her to have an illegal abortion, and then deserts her. By now the girl's life has been ruined, she has been ostracized by both her family and most likely all her friends and acquaintances. Then a car arrives, picks up the desperate young woman and drives her straight to one of the New York call houses operated by his syndicate. Once there, there is no way for her to escape. * Charlotte Manning, with whom Hammer falls in love and who, as far as he can see, has no motive whatsoever to kill Williams. Hammer, the first person narrator of the story, describes her as radiating sex in every manner and gesture (Mary [Bellemy] only had sex. Charlotte had that plus a lot more.). Charlotte confesses her love for him, and he says that he has never been in love before. Soon they talk about getting married. Hammer has always admired her golden hair; but not before the very end, when she strips, does he find out that Charlotte is a real blonde. In the course of the action Charlotte Manning kills five people: After committing her first murder, she has to cover up her tracks and murder anyone who might be able to expose her. As Hammer admits, she has an unusual amount of luck helping her to do all that. * Myrna Devlin, a former dope fiend who, as it turns out, does not play any important role in the plot at all except that of one of the victims: At the Bellemys' party (towards the end of the book), Myrna, alone in an upstairs room where most of the guests have left their coats, tries on Charlotte Manning's coat and discovers heroin in one of its pockets. This is the reason why Manning has to shoot her, too. It takes Hammer and Chambers a long time to figure out what is going on. Manning continues to kill those who have become dangerous for her. At the same time, her relationship with Hammer deepens. We see everything through Hammer's eyes, and for a long time he is completely blind to the facts (I hope you get him,' she said sincerely.). During a walk through Central Park, while Manning is baby-sitting for one of her friends, she and Hammer are shot at. The sniper is Kalecki, but it does not become clear until later that he was after Manning. He misses. On a Saturday morning, Hammer picks up Myrna Devlin and gives her a lift. They drive to the Bellemy twins' estate in the country for a gigantic all-day party there. Charlotte Manning says she has some business to attend to and will be there in time for a tennis game due to take place that evening. After an unsuccessful attempt at playing tennis himself, Hammer gets rid of his sleep deficit by spending all day in his room, fast asleep, with old junior &mdash; his gun &mdash; close to him. He is woken up just in time for dinner, during which Harmon Wilder, the Bellemys' lawyer, and Charles Sherman, Wilder's assistant, are pointed out to him. This is a fine &mdash; and the final &mdash; distractor in the novel: Wilder and Sherman are suddenly missing from the party after Myrna Devlin has been found shot. In fact they had illicit drugs on them and did not want to be found out. During the tennis game, Mary Bellemy asks Charlotte if she can borrow Hammer. Then she leads him into the woods where they have sex. They return to the party just as a maid discovers Myrna's body in an upstairs room, in front of a large mirror. Both Pat Chambers and the police are called in, and the alibis of each guest is checked. Again Charlotte can convince everyone that she could not have done anything. Back home, Hammer retreats into his apartment to think. Finally, he knows the identity of the killer. This is when he goes to Charlotte's place, recapitulates the whole crime and finally shoots her dead, despite her efforts to pull the trigger on him.",1947,1,Mike Hammer,hero,corruption,corruption,1,"The moral of the story is that appearances can be deceiving, and the pursuit of greed and power often leads to one's downfall.","Deception, Greed, Downfall",Greed,the quest,1940
71290,/m/0jd3p,"England, England",Julian Barnes,1998,"{/m/014dfn: Speculative fiction, /m/02xlf: Fiction}","England, England is divided into three parts entitled England, England, England and Anglia. The first part focuses on the protagonist Martha Cochrane and her childhood memories. Growing up in the surrounding of the English countryside, her peaceful childhood gets disrupted when her father leaves the family. Martha's memories of her father are closely related to playing a Counties of England jigsaw puzzle with him. The second part, England, England, is set in the near future in what is clearly marked as a postmodern age. Martha is now in her forties and gets employed by the entrepreneur Sir Jack Pitman for his megalomaniac project. Sir Jack aims to turn the Isle of Wight into a gigantic theme park which contains everything that people, especially tourists, consider to be quintessentially English, selected according to what Sir Jack himself approves of. The theme park called 'England, England' thus becomes a replica of England's best known historical buildings, figures and sites. Popular English tourist attractions and icons of 'Englishness' are crammed together to be easily accessible without having to travel whole 'real' England. While working on the set-up of the project, Martha starts an affair with one of her colleagues, Paul Harrison. They find out about Sir Jack's questionable sexual preferences and blackmail him with the discriminating evidence when Sir Jack wants to dismiss Martha. She thus becomes CEO of the Island project, which turns out to be a highly popular tourist attraction. As a consequence of the huge success, 'England, England' becomes an independent state and part of the European Union, while the real, 'Old England' suffers a severe decline and increasingly falls into oblivion. After a major scandal in the theme park, however, Martha is eventually expelled from the island. The third part of the novel, Anglia, is set decades later and depicts Martha who has returned to a village in Old England after many years of wandering abroad. The original nation has regressed into a vastly de-populated, agrarian and pre-industrial state without any international political influence, while 'England, England' continues to prosper. The chapter describes the villagers' endeavour to re-establish a traditional village fête with the help of Martha's memories. Martha ultimately spends her final days in this rural setting pondering about her past.",1998,1,Martha Cochrane,victim,hubris,authenticity vs simulation,2,The moral of the story is that the pursuit of commercialized and artificial representations of culture and identity can lead to the erosion of authentic heritage and values.,"Commercialization, Authenticity, Erosion",Hubris,the fall and redemption,1990
71416,/m/0jdh5,Dune,Frank Herbert,1965,"{/m/0594kx: Conspiracy fiction, /m/06n90: Science Fiction, /m/037mh8: Philosophy, /m/08sdrw: Adventure novel, /m/04chq5: Planetary romance, /m/02xlf: Fiction, /m/01smf2: Military science fiction}","Padishah Emperor Shaddam IV of House Corrino has come to fear House Atreides due to the growing popularity of Duke Leto Atreides within the Landsraad, the convocation of ruling Houses. Shaddam decides that House Atreides must be destroyed, but cannot risk an overt attack on a single House, as this would not be accepted by the Landsraad and could be met with civil war. The Emperor instead uses the centuries-old feud between House Atreides and House Harkonnen to disguise his assault, enlisting the brilliant and power-hungry Baron Vladimir Harkonnen in his plan to trap and eliminate the Atreides. To remove them from their fief of Caladan, where they are protected by their elite navy, Shaddam entices Leto to accept the lucrative fief of the spice planet, Arrakis, previously controlled by the Harkonnens. Leto's control of the only planet capable of spice production would increase the power of House Atreides, which has not, historically, been influential or wealthy. Complicating the political intrigue is the fact that the Duke's son Paul Atreides is an essential part of the Bene Gesserit's secret, centuries-old breeding program. Leto's concubine, the Bene Gesserit Lady Jessica, was ordered to give birth to a daughter. Capable of determining her child's sex due to her Bene Gesserit abilities, she instead bears a boy, to provide an heir for Leto. Leto correctly believes his rivals and enemies to be plotting against him, and the Atreides are able to thwart initial Harkonnen traps and complications while simultaneously building trust with the mysterious desert Fremen, with whom they hope to ally. However, the Atreides are ultimately unable to withstand a devastating Harkonnen attack, supported by House Corrino's elite Corps of Sardaukar, disguised as Harkonnen troops. The attack is assisted by a traitor within House Atreides Suk doctor Wellington Yueh, who is not suspected of disloyalty due to conditioning he underwent to complete his medical training. House Atreides' forces are unable to counterattack effectively and the House is scattered, with Leto taken captive by Yueh and delivered to the Harkonnens. Of the Houses' principal retainers, mentat Thufir Hawat is captured by the Sardaukar; the troubador-soldier Gurney Halleck escapes with the aid of smugglers, whom he joins; and military commander Duncan Idaho is killed defending Paul and Jessica. Yueh, who has only betrayed the Atreides to further a personal feud with Baron Harkonnen, plants a poison tooth in Leto's mouth, which he hopes will kill the Baron when bitten. Yueh is executed by the Baron, who distrusts him, but Leto manages to kill the Baron's chief retainer, mentat Piter De Vries, when he is brought before Harkonnen. The Baron evades the poison cloud expelled from the tooth, surviving the attack and enlisting Atreides mentat Thufir Hawat into his service. Jessica's Bene Gesserit abilities and Paul's developing skills, which have been taught to him by his mother, help them join a band of Fremen. Paul and his mother quickly learn Fremen ways while teaching the Fremen the weirding way, a Bene Gesserit method of fighting. Jessica becomes a Reverend Mother, ingesting the poisonous Water of Life while pregnant with her second child; this unborn daughter Alia is subjected to the same ordeal, acquiring the full abilities of a Reverend Mother before even being born. Paul takes a Fremen lover, Chani, with whom he fathers a son. Years pass, and Paul increasingly recognizes the strength of the Fremen fighting force and their potential to overtake even the unstoppable Sardaukar and win back Arrakis. The spice diet of the Fremen and his own developing mental powers cause Paul's prescience to be increase dramatically, allowing his forsight of future paths of possible events, and he is regarded by the Fremen as their prophesied messiah. As Paul grows in influence, he begins a jihad against Harkonnen rule of the planet under his new Fremen name, Muad'Dib. However, Paul becomes aware through his prescience that, if he is not careful, the Fremen will extend that jihad against all the known universe, which Paul describes as a humanity-spanning subconscious effort to avoid genetic stagnation. Both the Emperor and the Baron Harkonnen show increasing concern at the fervor of religious fanaticism shown on Arrakis for this Muad'Dib, not guessing that this leader is the presumed-dead Paul. Harkonnen plots to send his nephew and heir Feyd Rautha as a replacement for his more brutish nephew Glossu Rabban — who is in charge of the planet — with the hope of gaining the respect of the population. However, the Emperor is highly suspicious of the Baron and sends spies to watch his movements. Hawat explains the Emperor's suspicions: the Sardaukar, nearly invincible in battle, are trained on the prison planet Salusa Secundus, whose inhospitable conditions allow only the best to survive. Arrakis serves as a similar crucible, and the Emperor fears that the Baron could recruit from it a fighting force to rival his Sardaukar, just as House Atreides had intended before its destruction. Paul is reunited with Gurney. Completely loyal to the Atreides, Gurney is convinced that Jessica is the traitor who caused the House's downfall, and nearly kills her before being stopped by Paul. Disturbed that his prescience had not predicted this possibility, Paul decides to take the Water of Life, an act which will either confirm his status as the Kwisatz Haderach or kill him. After three weeks in a near-death state, Paul emerges with his powers refined and focused; he is able to see past, present, and future at will. Looking into space, he sees that the Emperor and the Harkonnens have amassed a huge armada to invade the planet and regain control. Paul also realizes the way to control spice production on Arrakis: saturating spice fields with the water of life would cause a chain reaction that would destroy all spice on the planet. In an Imperial attack on a Fremen settlement, Paul and Chani's son Leto is killed, and the four-year-old Alia is captured by Sardaukar and brought to the planet's capital Arrakeen, where the Baron Harkonnen is attempting to thwart the Fremen jihad under the close watch of the Emperor. The Emperor is surprised at Alia's defiance of his power and her confidence in her brother, whom she reveals to be Paul Atreides. At that moment, under cover of a gigantic sandstorm, Paul and his army of Fremen attack the city riding sandworms; Alia kills the Baron during the confusion. Paul quickly overtakes the city's defenses and confronts the Emperor, threatening to destroy the spice, thereby ending space travel and crippling both Imperial power and the Bene Gesserit in one blow. Feyd-Rautha challenges Paul to a knife-duel in a final attempt to stop his overthrow, but is defeated despite an attempt at treachery. Realizing that Paul is capable of doing all he has threatened, the Emperor is forced to abdicate and to promise his daughter Princess Irulan in marriage to Paul. Chani is not happy with this decision, and Paul describes that Chani will always be the one he loves. Paul ascends the throne, his control of Arrakis and the spice establishing a new kind of power over the Empire that will change the face of the known universe. However, despite being Emperor of the Known Universe, Paul realizes that he will not be able to stop the jihad he has seen in his visions, his legendary status among the Fremen having grown past the point where he can control it.",1965,1,Paul Atreides,hero,ambition,power and control,3,The moral of the story is that the pursuit of power and control can lead to unintended consequences that transcend individual desires and ambitions.,"Power, Consequences, Ambition",Overreaching ambition,the heros journey,1960
